{"v":1,"type":"HELLO","msg_id":"01J8X4K2P9QZ7M3N4R5T6V7W8X","session_id":"acct-8123456-EURUSD.iux-H1","ts_server":"2026-07-26T14:30:00Z","ts_sent":"2026-07-26T14:30:00.412Z","payload":{"token":"demo-token","ea_version":"1.0.0","terminal_build":4150,"account":{"login":8123456,"server":"ICMarketsSC-MT5","currency":"USD","leverage":500,"balance":10000.0,"equity":10123.45,"is_demo":true,"margin_mode":"RETAIL_HEDGING"},"symbol":{"name":"EURUSD.iux","digits":5,"point":0.00001,"tick_size":0.00001,"tick_value":1.0,"contract_size":100000.0,"volume_min":0.01,"volume_max":500.0,"volume_step":0.01,"stops_level":0,"freeze_level":0,"swap_long":-7.5,"swap_short":2.3,"trade_mode":"FULL","order_mode_closeby":true},"timeframe":"H1","strategy_id":"trend_v1","magic":770001,"local_limits":{"max_lot_per_order":0.5,"max_net_volume_per_symbol":1.0,"max_tickets_per_symbol":4,"max_total_tickets":8,"max_spread_points":25,"daily_loss_pct":2.0,"max_dd_pct":6.0}}}
