{"v":1,"type":"BAR","msg_id":"01J8X4K2P9QZ7M3N4R5T6V7W8X","session_id":"acct-8123456-EURUSD.iux-H1","ts_server":"2026-07-26T14:30:00Z","ts_sent":"2026-07-26T14:30:00.412Z","payload":{"symbol":"EURUSD.iux","timeframe":"H1","bar_time":"2026-07-26T14:00:00Z","open":1.1682,"high":1.16955,"low":1.16788,"close":1.16901,"tick_volume":4821,"real_volume":0,"spread_points_avg":8,"spread_points_max":31,"is_final":true}}
