{"v":1,"type":"RISK_DIRECTIVE","msg_id":"01J8X4K2P9QZ7M3N4R5T6V7W8X","session_id":"acct-8123456-EURUSD.iux-H1","ts_server":"2026-07-26T14:30:00Z","ts_sent":"2026-07-26T14:30:00.412Z","payload":{"directive_id":"01J8X4K2P9QZ7M3N4R5T6V7W8X","mode":"NORMAL","scale_factor":1.0,"reason":"risk-ok","detail":"demo account within limits","expires_at":"2026-07-26T15:30:00Z","flatten_symbols":["EURUSD.iux"],"x_forward_compat":"ignored"}}
