{"v":1,"type":"CONFIG_UPDATE","msg_id":"01J8X4K2P9QZ7M3N4R5T6V7W8X","session_id":"acct-8123456-EURUSD.iux-H1","ts_server":"2026-07-26T14:30:00Z","ts_sent":"2026-07-26T14:30:00.412Z","payload":{"config_id":"01J8X4K2P9QZ7M3N4R5T6V7W8X","settings":{"bar_backfill_count":300,"heartbeat_sec":2,"state_interval_sec":5,"verbose_log":false},"apply_at":"2026-07-26T14:31:00Z","x_forward_compat":"ignored"}}
