{"v":1,"type":"INTENT","msg_id":"01J8X4K2P9QZ7M3N4R5T6V7W8X","session_id":"acct-8123456-EURUSD.iux-H1","ts_server":"2026-07-26T14:30:00Z","ts_sent":"2026-07-26T14:30:00.412Z","payload":{"intent_id":"01J8X4K2P9QZ7M3N4R5T6V7W8X","symbol":"EURUSD.iux","target_volume":0.0,"max_slippage_points":1,"sl_price":1.0,"tp_price":1.0,"valid_until":"2026-07-26T14:30:00Z","urgency":"NORMAL","provenance":{"strategy_id":"trend_v1","decided_at":"2026-07-26T14:30:00Z","confidence":1.0,"feature_hash":"sha256:abcdef12","model_version":"value","news_state":"CLEAR","regime":"value","risk_scale_applied":1.0},"x_forward_compat":"ignored"}}
