{"v":1,"type":"EXEC_REPORT","msg_id":"01J8X4K2P9QZ7M3N4R5T6V7W8X","session_id":"acct-8123456-EURUSD.iux-H1","ts_server":"2026-07-26T14:30:00Z","ts_sent":"2026-07-26T14:30:00.412Z","payload":{"intent_id":"01J8X4K2P9QZ7M3N4R5T6V7W8X","op":"OPEN","result":"FILLED","retcode":10009,"retcode_text":"TRADE_RETCODE_DONE","side":"BUY","volume_requested":0.1,"volume_filled":0.1,"attempt":1,"commission":-0.7,"error":"","latency_ms":42,"price_filled":1.16902,"price_requested":1.16901,"slippage_points":1,"spread_at_send_points":12,"swap":0.0,"ticket":9007199254740993}}
