{"v":1,"type":"HEARTBEAT","msg_id":"01J8X4K2P9QZ7M3N4R5T6V7W8X","session_id":"acct-8123456-EURUSD.iux-H1","ts_server":"2026-07-26T14:30:00Z","ts_sent":"2026-07-26T14:30:00.412Z","payload":{"seq":1,"wire":{"state":"DISCONNECTED","send_queue_depth":1,"messages_sent":1,"messages_recv":1,"reconnect_count":1,"bytes_dropped":1,"seconds_since_last_inbound":1}}}
