{"v":1,"type":"STATE","msg_id":"01J8X4K2P9QZ7M3N4R5T6V7W8X","session_id":"acct-8123456-EURUSD.iux-H1","ts_server":"2026-07-26T14:30:00Z","ts_sent":"2026-07-26T14:30:00.412Z","payload":{"balance":1.0,"equity":1.0,"margin_used":1.0,"margin_free":1.0,"margin_level_pct":null,"equity_hwm":1.0,"day_start_equity":1.0,"day_pl":1.0,"day_pl_pct":1.0,"positions":[],"pending_orders":[],"owned_net":{"EURUSD.iux":0.0},"owned_ticket_count":{"EURUSD.iux":1},"foreign_positions":{"count":1,"symbols":[],"total_volume":1.0,"margin_estimate":1.0},"account_margin_mode":"RETAIL_HEDGING","guard":{"halted":true,"mode":"NORMAL","current_spread_points":1,"internal_hedge_detected":true}}}
