{"v":1,"type":"HELLO","msg_id":"01J8X4K2P9QZ7M3N4R5T6V7W8X","session_id":"acct-8123456-EURUSD.iux-H1","ts_server":"2026-07-26T14:30:00Z","ts_sent":"2026-07-26T14:30:00.412Z","payload":{"token":"value","ea_version":"1.0.0","terminal_build":3800,"account":{"login":1,"server":"value","currency":"USD","leverage":1,"balance":1.0,"equity":1.0,"is_demo":true,"margin_mode":"RETAIL_HEDGING"},"symbol":{"name":"EURUSD.iux","digits":1,"point":1.0,"tick_size":1.0,"tick_value":1.0,"contract_size":1.0,"volume_min":1.0,"volume_max":1.0,"volume_step":1.0,"stops_level":1,"freeze_level":1,"swap_long":1.0,"swap_short":1.0,"trade_mode":"FULL","order_mode_closeby":true},"timeframe":"M1","strategy_id":"trend_v1","magic":1,"local_limits":{"max_lot_per_order":1.0,"max_net_volume_per_symbol":1.0,"max_tickets_per_symbol":1,"max_total_tickets":1,"max_spread_points":1,"daily_loss_pct":1.0,"max_dd_pct":1.0},"broker_time":{"utc_offset_sec":1,"detected_at":"2026-07-26T14:30:00Z","source":"INFERRED_SERVER_MINUS_GMT","local_dst_sec":1,"local_gmt_offset_sec":1},"x_forward_compat":"ignored"}}
