{"v":1,"type":"HELLO_ACK","msg_id":"01J8X4K2P9QZ7M3N4R5T6V7W8X","session_id":"acct-8123456-EURUSD.iux-H1","ts_server":"2026-07-26T14:30:00Z","ts_sent":"2026-07-26T14:30:00.412Z","payload":{"accepted":true,"server_time":"2026-07-26T14:30:00Z","brain_version":"1.0.0","assigned_session_id":"acct-8123456-EURUSD.iux-H1","initial_directive":{"mode":"NORMAL","scale_factor":1.0},"reject_reason":"BAD_TOKEN"}}
