{"v":1,"type":"EXEC_REPORT","msg_id":"01J8X4K2P9QZ7M3N4R5T6V7W8X","session_id":"acct-8123456-EURUSD.iux-H1","ts_server":"2026-07-26T14:30:00Z","ts_sent":"2026-07-26T14:30:00.412Z","payload":{"intent_id":"01J8X4K2P9QZ7M3N4R5T6V7W8X","op":"OPEN","result":"FILLED","retcode":1,"retcode_text":"value","side":"BUY","volume_requested":1.0,"volume_filled":1.0,"attempt":1}}
