{"v":1,"type":"STATE","msg_id":"01J8X4K2P9QZ7M3N4R5T6V7W8X","session_id":"acct-8123456-EURUSD.iux-H1","ts_server":"2026-07-26T14:30:00Z","ts_sent":"2026-07-26T14:30:00.412Z","payload":{"balance":10000.0,"equity":10123.45,"margin_used":245.67,"margin_free":9877.78,"margin_level_pct":4120.5,"equity_hwm":10200.0,"day_start_equity":10050.0,"day_pl":73.45,"day_pl_pct":0.73,"positions":[{"ticket":9007199254740993,"symbol":"EURUSD.iux","side":"BUY","volume":0.1,"price_open":1.1682,"sl":1.1642,"tp":1.1762,"profit":12.34,"swap":-0.75,"magic":770001,"time_open":"2026-07-26T13:00:00Z","comment":"trend_v1:01J8X4K2P9QZ"}],"pending_orders":[{"ticket":9007199254740994,"symbol":"XAUUSD.iux","type":"BUY_LIMIT","volume":0.02,"price_open":2385.5,"magic":770002,"time_setup":"2026-07-26T13:30:00Z","sl":2375.5,"time_expiration":"2026-07-26T18:00:00Z","tp":2405.5}],"owned_net":{"EURUSD.iux":0.1},"owned_ticket_count":{"EURUSD.iux":1},"foreign_positions":{"count":1,"symbols":["XAUUSD.iux"],"total_volume":0.02,"margin_estimate":47.71},"account_margin_mode":"RETAIL_HEDGING","guard":{"halted":false,"mode":"NORMAL","current_spread_points":12,"internal_hedge_detected":false,"halt_reason":null,"halted_until":null},"x_forward_compat":"ignored"}}
